Ken,gdpr recital,bdpr recital,similarity
,"in cases other than those referred to in paragraph 1, the controller or processor or associations and other bodies representing categories of controllers or processors may or, where required by union or member state law shall, designate a data protection officer. the data protection officer may act for such associations and other bodies representing controllers or processors.","- data protection officer: person named by the controller and processor to act as a channel of communication between the controller, the subjects of such data and the national data protection authority (anpd); (new wording given by law no. 13,853/2019)",0.953695639
,"associations and other bodies referred to in paragraph 2 of this article which intend to prepare a code of conduct or to amend or extend an existing code shall submit the draft code, amendment or extension to the supervisory authority which is competent pursuant to article 55. the supervisory authority shall provide an opinion on whether the draft code, amendment or extension complies with this regulation and shall approve that draft code, amendment or extension if it finds that it provides sufficient appropriate safeguards.","§3 the national authority may designate certification entities to carry out the provisions of the lead sentence of this article, which shall remain under their inspection and subject to the terms defined in regulation.",0.953604566
,"in the context of the evaluations and reviews referred to in paragraph 1, the commission shall examine, in particular, the application and functioning of:","sole paragraph. anpd shall articulate its operation and practices with other bodies and entities with sanctioning and normative powers related to matters of personal data protection, and it shall be the central body for the interpretation of this law and for setting the standards and guidelines for the implementation thereof. (included by law no. 13,853/2019)",0.95352794
,"the period for which the personal data will be stored, or if that is not possible, the criteria used to determine that period;","– by means of a clear and complete declaration that indicates the origin of the data, the nonexistence of registration, the criteria used and the purpose of the processing, subject to commercial and industrial secrecy, provided within a period of fifteen (15) days as from the date of the data subject’s request.",0.953526854
,"issue guidelines, recommendations and best practices in accordance with point (e) of this paragraph for further specifying the criteria and conditions for decisions based on profiling pursuant to article 22(2);",§2 the measures mentioned in the lead sentence of this article shall be complied with as from the conception phase of the product or service until its execution.,0.953517065
,assists the controller in ensuring compliance with the obligations pursuant to articles 32 to 36 taking into account the nature of processing and the information available to the processor;,"– processors are jointly liable for damages caused by the processing when they do not comply with the obligations of data protection legislation or when they have not followed controller’s lawful instructions. in this last case, the processor is deemed equivalent to the controller, save from cases of exclusion as provided in art. 43 of this law;",0.953496979
,member states shall provide for each member of their supervisory authorities to be appointed by means of a transparent procedure by:,"§1 pursuant to the lead sentence of this article, the president’s chief of staff shall be responsible for initiating the disciplinary administrative proceeding, which shall be conducted by a special commission composed of stable federal public servants.",0.953445214
,the supervisory authorities concerned shall not adopt a decision on the subject matter submitted to the board under paragraph 1 during the periods referred to in paragraphs 2 and 3.,§2 contracts and agreements as mentioned in §1 of this article shall be communicated to the national authority.,0.953361667
,the risks to the rights and freedoms of data subjects; and,protecting life or physical safety of the data subject or a third party;,0.953335035
,"are legally binding and apply to and are enforced by every member concerned of the group of undertakings, or group of enterprises engaged in a joint economic activity, including their employees;","§4 the anpd shall maintain a permanent communication forum, including by technical cooperation, with bodies and entities of the public administration responsible for the regulation of specific sectors of economic and governmental activity, in order to facilitate",0.953306036
,the data subjects' rights pursuant to articles 12 to 22;,"§5 the request as mentioned in §3 of this article shall be fulfilled without costs to the data subject, within the time periods and the terms as provided in regulation.",0.953143425
,"to order the controller or processor to bring processing operations into compliance with the provisions of this regulation, where appropriate, in a specified manner and within a specified period;","§1 whenever requested to do so, the controller shall provide clear and adequate information regarding the criteria and procedures used for an automated decision, subject to commercial and industrial secrecy.",0.953051851
,"where the personal data must remain confidential subject to an obligation of professional secrecy regulated by union or member state law, including a statutory obligation of secrecy.","§4 notarial and registry services, carried out under private nature by delegation of public authorities, shall receive the same treatment given to legal entities as provided in the lead sentence of this article, in accordance with the terms of this law.",0.953016262
,"each member state shall provide by law that its supervisory authority shall have the power to bring infringements of this regulation to the attention of the judicial authorities and where appropriate, to commence or engage otherwise in legal proceedings, in order to enforce the provisions of this regulation.","§5 in the exercise of the powers referred to in the lead sentence of this article, the relevant authority shall ensure the preservation of industrial and information secrecy, in the terms of the law.",0.952905611
,for reasons of public interest in the area of public health in accordance with points (h) and (i) of article 9(2) as well as article 9(3);,§8 the right referred to in §1 of this article may also be exercised before consumer- defense entities.,0.952822564
,"promote public awareness and understanding of the risks, rules, safeguards and rights in relation to processing. activities addressed specifically to children shall receive specific attention;",demonstrate the controller’s commitment to adopt internal procedures and policies that ensure broad compliance with rules and good practices regarding the protection of personal data;,0.952678478
,"draw up guidelines for supervisory authorities concerning the application of measures referred to in article 58(1), (2) and (3) and the setting of administrative fines pursuant to article 83;","§5 guarantees that are sufficient for compliance with the general principles of protection and data subject’s rights referred to in the lead sentence of this article shall also be analyzed in accordance with the technical and organizational measures adopted by the processor, according to the provisions of §§1 and 2 of art. 46 of this law.",0.952652515
,"paragraphs 1, 2 and 3 shall not apply where and insofar as the data subject already has the information.",§2 the assessment of the transformation referred in the §1 of this article shall occur,0.952650177
,"the board shall collate all approved codes of conduct, amendments and extensions in a register and shall make them publicly available by way of appropriate means.","§1 processing of personal data as provided in item iii shall be governed by specific legislation, which shall provide proportional and strictly necessary measures for fulfilling the public interest, subject to due legal process, the general principles of protection and the rights of the data subjects as provided in this law.",0.952648142
,"to obtain, from the controller and the processor, access to all personal data and to all information necessary for the performance of its tasks;","§4 communication or shared use between controllers of sensitive personal data referring to health for the purpose of obtaining an economic advantage is prohibited, except in cases of portability of data when consented by the data subject.",0.952634363
,the commission shall enter into consultations with the third country or international organisation with a view to remedying the situation giving rise to the decision made pursuant to paragraph 5.,"§3 the national authority shall issue technical opinions or recommendations regarding the exceptions provided in item iii of the lead sentence of this article, and shall request of the responsible parties a data protection impact assessment.",0.952523864
,"the data subject shall have the right to withdraw his or her consent at any time. the withdrawal of consent shall not affect the lawfulness of processing based on consent before its withdrawal. prior to giving consent, the data subject shall be informed thereof. it shall be as easy to withdraw as to give consent.","§2 in the situation when consent is required, if there are changes in the purpose of the processing of personal data that are not compatible with the original consent, the controller shall previously inform the data subject of the changes of purpose, and the data subject may revoke her/his consent if she/he disagrees with the changes.",0.952486479
,the controller and processor shall ensure that the data protection officer does not receive any instructions regarding the exercise of those tasks. he or she shall not be dismissed or penalised by the controller or the processor for performing his tasks. the data protection officer shall directly report to the highest management level of the controller or the processor.,"- data protection officer: person named by the controller and processor to act as a channel of communication between the controller, the subjects of such data and the national data protection authority (anpd); (new wording given by law no. 13,853/2019)",0.952334023
,provide the commission with an opinion on the certification requirements referred to in article 43(8);,"§5 guarantees that are sufficient for compliance with the general principles of protection and data subject’s rights referred to in the lead sentence of this article shall also be analyzed in accordance with the technical and organizational measures adopted by the processor, according to the provisions of §§1 and 2 of art. 46 of this law.",0.952294711
,"where the commission requests advice from the board, it may indicate a time limit, taking into account the urgency of the matter.","§3 the national authority shall issue technical opinions or recommendations regarding the exceptions provided in item iii of the lead sentence of this article, and shall request of the responsible parties a data protection impact assessment.",0.952254275
,"established procedures and structures to handle complaints about infringements of the certification or the manner in which the certification has been, or is being, implemented by the controller or processor, and to make those procedures and structures transparent to data subjects and the public; and","§1 whenever requested to do so, the controller shall provide clear and adequate information regarding the criteria and procedures used for an automated decision, subject to commercial and industrial secrecy.",0.95222668
,"a delegated act adopted pursuant to article 12(8) and article 43(8) shall enter into force only if no objection has been expressed by either the european parliament or the council within a period of three months of notification of that act to the european parliament and the council or if, before the expiry of that period, the european parliament and the council have both informed the commission that they will not object. that period shall be extended by three months at the initiative of the european parliament or of the council.","§2 the president of the republic shall be responsible for determining the preventive work leave, solely when recommended by the special commission referred in the §1 of this article, and then hand down the decision. (included by law no. 13,853/2019)",0.952062733
,"where the board has been unable to adopt a decision within the periods referred to in paragraph 2, it shall adopt its decision within two weeks following the expiration of the second month referred to in paragraph 2 by a simple majority of the members of the board. where the members of the board are split, the decision shall by adopted by the vote of its chair.","§2 the president of the republic shall be responsible for determining the preventive work leave, solely when recommended by the special commission referred in the §1 of this article, and then hand down the decision. (included by law no. 13,853/2019)",0.952037363
,takes all measures required pursuant to article 32;,"§5 guarantees that are sufficient for compliance with the general principles of protection and data subject’s rights referred to in the lead sentence of this article shall also be analyzed in accordance with the technical and organizational measures adopted by the processor, according to the provisions of §§1 and 2 of art. 46 of this law.",0.951964243
,"established in the union; the controller or the processor shall be exempt from that liability, in whole or in part, only if it proves that that member is not responsible for the event giving rise to the damage;","sole paragraph. public and mixed-capital companies, when they are carrying out public policies and within the scope of their execution, shall receive the same treatment given to the bodies and entities of the public authorities, under the terms of this chapter.",0.951959729
,"each member shall have the qualifications, experience and skills, in particular in the area of the protection of personal data, required to perform its duties and exercise its powers.",– when the transfer is necessary to protect the life or physical safety of the data subject or of a third party;,0.951908402
,to order the controller or the processor to comply with the data subject's requests to exercise his or her rights pursuant to this regulation;,"§1 whenever requested to do so, the controller shall provide clear and adequate information regarding the criteria and procedures used for an automated decision, subject to commercial and industrial secrecy.",0.951906083
,to carry out investigations in the form of data protection audits;,"– to carry out audits, or to determine their occurrence regarding the processing of personal data carried out by processing agents, including public authorities;",0.951834819
,the pseudonymisation of personal data;,retention of the personal data or the database;,0.951792686
,member states shall lay down the rules on other penalties applicable to infringements of this regulation in particular for infringements which are not subject to administrative fines pursuant to,sole paragraph. breach to the provisions set forth in the lead sentence of this article shall characterize an act of administrative improbity.,0.951699824
,"the lead supervisory authority shall adopt and notify the decision to the main establishment or single establishment of the controller or processor, as the case may be and inform the other supervisory authorities concerned and the board of the decision in question, including a summary of the relevant facts and grounds. the supervisory authority with which a complaint has been lodged shall inform the complainant on the decision.","§3 the national authority shall issue technical opinions or recommendations regarding the exceptions provided in item iii of the lead sentence of this article, and shall request of the responsible parties a data protection impact assessment.",0.951519585
,"points (a), (b) and (c) of the first subparagraph of paragraph 1 and the second subparagraph thereof shall not apply to activities carried out by public authorities in the exercise of their public powers.","§1 the communication shall be done in a reasonable time period, as defined by the national authority, and shall contain, at the very least:",0.951480219
,a certification pursuant to this article does not reduce the responsibility of the controller or the processor for compliance with this regulation and is without prejudice to the tasks and powers of the supervisory authorities which are competent pursuant to article 55 or 56.,– compliance with a legal or regulatory obligation by the controller;,0.951311833
,"as regards a processor with establishments in more than one member state, the place of its central administration in the union, or, if the processor has no central administration in the union, the establishment of the processor in the union where the main processing activities in the context of the activities of an establishment of the processor take place to the extent that the processor is subject to specific obligations under this regulation;","– the processing activity is aimed at the offering or provision of goods or services, or at the processing of data of individuals located on the national territory; or (new wording given by law no. 13,853/2019)",0.951195139
,"‘international organisation’ means an organisation and its subordinate bodies governed by public international law, or any other body which is set up by, or on the basis of, an agreement between two or more countries.","- resources derived from agreements, contracts or similar instruments held with entities, bodies or companies, of either public or private law, national or international;",0.951099863
,court proceedings for exercising the right to receive compensation shall be brought before the courts competent under the law of the member state referred to in article 79(2).,"§2 processing of the data referred to in item iii of the lead sentence of this article is forbidden for legal entity of private law, except in procedures under the authority of legal entity of public law, of which the national authority shall be specifically informed and which shall observe the limitation imposed in §4 of this article.",0.951066099
,keep internal records of infringements of this regulation and of measures taken in accordance with article 58(2); and,"§5 guarantees that are sufficient for compliance with the general principles of protection and data subject’s rights referred to in the lead sentence of this article shall also be analyzed in accordance with the technical and organizational measures adopted by the processor, according to the provisions of §§1 and 2 of art. 46 of this law.",0.951018032
,"each supervisory authority shall ensure that the imposition of administrative fines pursuant to this article in respect of infringements of this regulation referred to in paragraphs 4, 5 and 6 shall in each individual case be effective, proportionate and dissuasive.",sole paragraph. breach to the provisions set forth in the lead sentence of this article shall characterize an act of administrative improbity.,0.951001084
,"adequate, relevant and limited to what is necessary in relation to the purposes for which they are processed (‘data minimisation’);","- necessity: limitation of the processing to the minimum necessary to achieve its purposes, covering data that are relevant, proportional and non-excessive in relation to the purposes of the data processing;",0.950829375
,the european data protection board (the ‘board’) is hereby established as a body of the union and shall have legal personality.,"sole paragraph. for purposes of item i of this article, the legal entities of public law referred to in the sole paragraph of art. 1 of law no. 12,527, of november 18, 2011 (the “brazilian access to information law”), within their legal capabilities, and those parties accountable, within the scope of their activities, may request the national authority to evaluate the level of protection of personal data provided by a country or international organization.",0.950812843
,"‘biometric data’ means personal data resulting from specific technical processing relating to the physical, physiological or behavioural characteristics of a natural person, which allow or confirm the unique identification of that natural person, such as facial images or dactyloscopic data;",– data subject: a natural person to whom the personal data that are the object of processing refer to;,0.950730939
,"where processing referred to in paragraphs 2 and 3 serves at the same time another purpose, the derogations shall apply only to processing for the purposes referred to in those paragraphs.","§4 consent shall refer to particular purposes, and generic authorizations for processing personal data shall be considered void.",0.950700353
,"a monitoring, inspection or regulatory function connected, even occasionally, to the exercise of official authority in the cases referred to in points (a) to (e) and (g);","§3 when the processing of personal data is a condition for the provision of a product or service or for the exercise of a right, the data subject shall be informed with special highlight of this fact and of the means by which she/he may exercise her/his data subject’s rights as listed in art. 18 of this law.",0.95063846
,"where the opinion referred to in paragraph 7 confirms that the draft code, amendment or extension complies with this regulation, or, in the situation referred to in paragraph 3, provides appropriate safeguards, the board shall submit its opinion to the commission.","§3 the national authority shall issue technical opinions or recommendations regarding the exceptions provided in item iii of the lead sentence of this article, and shall request of the responsible parties a data protection impact assessment.",0.950352921
,‘supervisory authority concerned’ means a supervisory authority which is concerned by the processing of personal data because:,"– when the controller offers and proves guarantees of compliance with the principles and the rights of the data subject and the regime of data protection provided in this law, in the form of:",0.950274594
,the controller shall provide the information referred to in paragraphs 1 and 2:,"§4 if it is impossible to immediately adopt the measure mentioned in §3 of this article, the controller shall send a reply to the data subject in which she/he may:",0.950111038
,"the supervisory authorities shall, where appropriate, conduct joint operations including joint investigations and joint enforcement measures in which members or staff of the supervisory authorities of other member states are involved.","§1 pursuant to the lead sentence of this article, the president’s chief of staff shall be responsible for initiating the disciplinary administrative proceeding, which shall be conducted by a special commission composed of stable federal public servants.",0.950074583
,the degree of responsibility of the controller or processor taking into account technical and organisational measures implemented by them pursuant to articles 25 and 32;,"§5 guarantees that are sufficient for compliance with the general principles of protection and data subject’s rights referred to in the lead sentence of this article shall also be analyzed in accordance with the technical and organizational measures adopted by the processor, according to the provisions of §§1 and 2 of art. 46 of this law.",0.950006084
,"the controller or processor which submits its processing to the certification mechanism shall provide the certification body referred to in article 43, or where applicable, the competent supervisory authority, with all information and access to its processing activities which are necessary to conduct the certification procedure.","§1 whenever requested to do so, the controller shall provide clear and adequate information regarding the criteria and procedures used for an automated decision, subject to commercial and industrial secrecy.",0.949896047
,the commission may lay down standard contractual clauses for the matters referred to in paragraph 3 and 4 of this article and in accordance with the examination procedure referred to in article 93(2).,"§6 complaints collected in accordance with the provisions set forth in item v of the lead sentence of this article may be analyzed in an aggregate manner and any measures arising therefrom may be adopted in a standardized manner. (included by law no. 13,853/2019)",0.949644201
,"each member state shall ensure that each supervisory authority is subject to financial control which does not affect its independence and that it has separate, public annual budgets, which may be part of the overall state or national budget.","§1 the legal nature of the anpd is transitional and may be transformed by the executive branch into an indirect federal public administration entity, subject to a special autarchic regime and pertaining to the presidency of the republic.",0.949570261
,"the board shall take decisions by a simple majority of its members, unless otherwise provided for in this regulation.","§3 the national authority may designate certification entities to carry out the provisions of the lead sentence of this article, which shall remain under their inspection and subject to the terms defined in regulation.",0.949556714
