Ken,gdpr recital,bdpr recital,similarity
1,"the purpose of the processing shall be determined in that legal basis or, as regards the processing referred to in point (e) of paragraph 1, shall be necessary for the performance of a task carried out in the public interest or in the exercise of official authority vested in the controller. that legal basis may contain specific provisions to adapt the application of rules of this regulation, inter alia: the general conditions governing the lawfulness of processing by the controller; the types of data which are subject to the processing; the data subjects concerned; the entities to, and the purposes for which, the personal data may be disclosed; the purpose limitation; storage periods; and processing operations and processing procedures, including measures to ensure lawful and fair processing such as those for other specific processing situations as provided for in chapter ix. the union or the member state law shall meet an objective of public interest and be proportionate to the legitimate aim pursued.","§1 processing of personal data as provided in item iii shall be governed by specific legislation, which shall provide proportional and strictly necessary measures for fulfilling the public interest, subject to due legal process, the general principles of protection and the rights of the data subjects as provided in this law.",0.988966722
0,"‘recipient’ means a natural or legal person, public authority, agency or another body, to which the personal data are disclosed, whether a third party or not. however, public authorities which may receive personal data in the framework of a particular inquiry in accordance with union or member state law shall not be regarded as recipients; the processing of those data by those public authorities shall be in compliance with the applicable data protection rules according to the purposes of the processing;","sole paragraph. for purposes of item i of this article, the legal entities of public law referred to in the sole paragraph of art. 1 of law no. 12,527, of november 18, 2011 (the “brazilian access to information law”), within their legal capabilities, and those parties accountable, within the scope of their activities, may request the national authority to evaluate the level of protection of personal data provided by a country or international organization.",0.985225043
0,"where personal data are processed for scientific or historical research purposes or statistical purposes pursuant to article 89(1), the data subject, on grounds relating to his or her particular situation, shall have the right to object to processing of personal data concerning him or her, unless the processing is necessary for the performance of a task carried out for reasons of public interest.","– to request, at any time, that entities of the public authority carry out operations of processing of personal data to give specific report about the scope and nature of the data and other details of the processing, and may issue complementary technical opinion to ensure compliance with this law;",0.984889738
1,"processing of personal data revealing racial or ethnic origin, political opinions, religious or philosophical beliefs, or trade union membership, and the processing of genetic data, biometric data for the purpose of uniquely identifying a natural person, data concerning health or data concerning a natural person's sex life or sexual orientation shall be prohibited.","– sensitive personal data: personal data concerning racial or ethnic origin, religious belief, political opinion, trade union or religious, philosophical or political organization membership, data concerning health or sex life, genetic or biometric data, when related to a natural person;",0.984471099
0,"the provision of such information proves impossible or would involve a disproportionate effort, in particular for processing for archiving purposes in the public interest, scientific or historical research purposes or statistical purposes, subject to the conditions and safeguards referred to in article 89(1) or in so far as the obligation referred to in paragraph 1 of this article is likely to render impossible or seriously impair the achievement of the objectives of that processing. in such cases the controller shall take appropriate measures to protect the data subject's rights and freedoms and legitimate interests, including making the information publicly available;","– to request, at any time, that entities of the public authority carry out operations of processing of personal data to give specific report about the scope and nature of the data and other details of the processing, and may issue complementary technical opinion to ensure compliance with this law;",0.984124843
0,"where, in cases referred to in paragraph 1 of this article, the controller is able to demonstrate that it is not in a position to identify the data subject, the controller shall inform the data subject accordingly, if possible. in such cases, articles 15 to 20 shall not apply except where the data subject, for the purpose of exercising his or her rights under those articles, provides additional information enabling his or her identification.","§5 the controller who has obtained the consent referred to in item i of the lead sentence of this article that needs to communicate or share personal data with other controllers shall obtain specific consent from the data subject for this purpose, except when the need for such consent is waived as provided in this law.",0.984103313
0,"prior to the adoption of the lists referred to in paragraphs 4 and 5, the competent supervisory authority shall apply the consistency mechanism referred to in article 63 where such lists involve processing activities which are related to the offering of goods or services to data subjects or to the monitoring of their behaviour in several member states, or may substantially affect the free movement of personal data within the union.","§3 when the processing of personal data is a condition for the provision of a product or service or for the exercise of a right, the data subject shall be informed with special highlight of this fact and of the means by which she/he may exercise her/his data subject’s rights as listed in art. 18 of this law.",0.983699233
0,data subjects may contact the data protection officer with regard to all issues related to processing of their personal data and to the exercise of their rights under this regulation.,"§4 communication or shared use between controllers of sensitive personal data referring to health for the purpose of obtaining an economic advantage is prohibited, except in cases of portability of data when consented by the data subject.",0.983641983
0,processing of personal data relating to criminal convictions and offences or related security measures based on article 6(1) shall be carried out only under the control of official authority or when the processing is authorised by union or member state law providing for appropriate safeguards for the rights and freedoms of data subjects. any comprehensive register of criminal convictions shall be kept only under the control of official authority.,"§5 in the exercise of the powers referred to in the lead sentence of this article, the relevant authority shall ensure the preservation of industrial and information secrecy, in the terms of the law.",0.983254125
0,"the data subject shall have the right to object, on grounds relating to his or her particular situation, at any time to processing of personal data concerning him or her which is based on point (e) or (f) of article 6(1), including profiling based on those provisions. the controller shall no longer process the personal data unless the controller demonstrates compelling legitimate grounds for the processing which override the interests, rights and freedoms of the data subject or for the establishment, exercise or defence of legal claims.","– to request, at any time, that entities of the public authority carry out operations of processing of personal data to give specific report about the scope and nature of the data and other details of the processing, and may issue complementary technical opinion to ensure compliance with this law;",0.982852235
,"where processing pursuant to point (c) or (e) of article 6(1) has a legal basis in union law or in the law of the member state to which the controller is subject, that law regulates the specific processing operation or set of operations in question, and a data protection impact assessment has already been carried out as part of a general impact assessment in the context of the adoption of that legal basis, paragraphs 1 to 7 shall not apply unless member states deem it to be necessary to carry out such an assessment prior to processing activities.","§5 guarantees that are sufficient for compliance with the general principles of protection and data subject’s rights referred to in the lead sentence of this article shall also be analyzed in accordance with the technical and organizational measures adopted by the processor, according to the provisions of §§1 and 2 of art. 46 of this law.",0.982395457
,the transfer of personal data to third countries or international organisations; or,– international data transfer: transfer of personal data to a foreign country or to an international entity of which the country is a member;,0.982365988
,"each member state shall ensure that each supervisory authority is provided with the human, technical and financial resources, premises and infrastructure necessary for the effective performance of its tasks and exercise of its powers, including those to be carried out in the context of mutual assistance, cooperation and participation in the board.","§4 the anpd shall maintain a permanent communication forum, including by technical cooperation, with bodies and entities of the public administration responsible for the regulation of specific sectors of economic and governmental activity, in order to facilitate",0.98227107
,"the data subject has given explicit consent to the processing of those personal data for one or more specified purposes, except where union or member state law provide that the prohibition referred to in paragraph 1 may not be lifted by the data subject;","§3 when the processing of personal data is a condition for the provision of a product or service or for the exercise of a right, the data subject shall be informed with special highlight of this fact and of the means by which she/he may exercise her/his data subject’s rights as listed in art. 18 of this law.",0.981658408
,"where the processing for a purpose other than that for which the personal data have been collected is not based on the data subject's consent or on a union or member state law which constitutes a necessary and proportionate measure in a democratic society to safeguard the objectives referred to in article 23(1), the controller shall, in order to ascertain whether processing for another purpose is compatible with the purpose for which the personal data are initially collected, take into account, inter alia:","– to request, at any time, that entities of the public authority carry out operations of processing of personal data to give specific report about the scope and nature of the data and other details of the processing, and may issue complementary technical opinion to ensure compliance with this law;",0.981322974
,"processing is necessary for reasons of substantial public interest, on the basis of union or member state law which shall be proportionate to the aim pursued, respect the essence of the right to data protection and provide for suitable and specific measures to safeguard the fundamental rights and the interests of the data subject;","§1 processing of personal data as provided in item iii shall be governed by specific legislation, which shall provide proportional and strictly necessary measures for fulfilling the public interest, subject to due legal process, the general principles of protection and the rights of the data subjects as provided in this law.",0.981238461
,"the controller shall take appropriate measures to provide any information referred to in articles 13 and 14 and any communication under articles 15 to 22 and 34 relating to processing to the data subject in a concise, transparent, intelligible and easily accessible form, using clear and plain language, in particular for any information addressed specifically to a child. the information shall be provided in writing, or by other means, including, where appropriate, by electronic means. when requested by the data subject, the information may be provided orally, provided that the identity of the data subject is proven by other means.","§2 when processing data as mentioned in §1 of this article, controllers shall make public the information about the types of data collected, the way it is used and the procedures for exercising the rights of data subjects referred to in art. 18 of this law.",0.981230081
,"in addition to the information referred to in paragraph 1, the controller shall provide the data subject with the following information necessary to ensure fair and transparent processing in respect of the data subject:","– to request, at any time, that entities of the public authority carry out operations of processing of personal data to give specific report about the scope and nature of the data and other details of the processing, and may issue complementary technical opinion to ensure compliance with this law;",0.981016895
,"processes the personal data only on documented instructions from the controller, including with regard to transfers of personal data to a third country or an international organisation, unless required to do so by union or member state law to which the processor is subject; in such a case, the processor shall inform the controller of that legal requirement before processing, unless that law prohibits such information on important grounds of public interest;",– controller: natural person or legal entity of either public or private law in charge of making the decisions regarding the processing of personal data;,0.980955172
,the communication to the data subject referred to in paragraph 1 shall not be required if any of the following conditions are met:,"§4 controllers shall not condition the participation of data subjects, as referred to in",0.980834467
,"where personal data are processed for scientific or historical research purposes or statistical purposes, union or member state law may provide for derogations from the rights referred to in articles 15, 16, 18 and 21 subject to the conditions and safeguards referred to in paragraph 1 of this article in so far as such rights are likely to render impossible or seriously impair the achievement of the specific purposes, and such derogations are necessary for the fulfilment of those purposes.","§5 guarantees that are sufficient for compliance with the general principles of protection and data subject’s rights referred to in the lead sentence of this article shall also be analyzed in accordance with the technical and organizational measures adopted by the processor, according to the provisions of §§1 and 2 of art. 46 of this law.",0.980804303
,"where personal data are processed for archiving purposes in the public interest, union or member state law may provide for derogations from the rights referred to in articles 15, 16, 18, 19, 20 and 21 subject to the conditions and safeguards referred to in paragraph 1 of this article in so far as such rights are likely to render impossible or seriously impair the achievement of the specific purposes, and such derogations are necessary for the fulfilment of those purposes.","§5 guarantees that are sufficient for compliance with the general principles of protection and data subject’s rights referred to in the lead sentence of this article shall also be analyzed in accordance with the technical and organizational measures adopted by the processor, according to the provisions of §§1 and 2 of art. 46 of this law.",0.980589636
,"union or member state law to which the data controller or processor is subject may restrict by way of a legislative measure the scope of the obligations and rights provided for in articles 12 to 22 and article 34, as well as article 5 in so far as its provisions correspond to the rights and obligations provided for in articles 12 to 22, when such a restriction respects the essence of the fundamental rights and freedoms and is a necessary and proportionate measure in a democratic society to safeguard:","§5 guarantees that are sufficient for compliance with the general principles of protection and data subject’s rights referred to in the lead sentence of this article shall also be analyzed in accordance with the technical and organizational measures adopted by the processor, according to the provisions of §§1 and 2 of art. 46 of this law.",0.980516716
,"where personal data are transferred to a third country or to an international organisation, the data subject shall have the right to be informed of the appropriate safeguards pursuant to article 46 relating to the transfer.","sole paragraph. for purposes of item i of this article, the legal entities of public law referred to in the sole paragraph of art. 1 of law no. 12,527, of november 18, 2011 (the “brazilian access to information law”), within their legal capabilities, and those parties accountable, within the scope of their activities, may request the national authority to evaluate the level of protection of personal data provided by a country or international organization.",0.980356044
,"‘third party’ means a natural or legal person, public authority, agency or body other than the data subject, controller, processor and persons who, under the direct authority of the controller or processor, are authorised to process personal data;",– processor: natural person or legal entity of either public or private law that processes personal data in the name of the controller;,0.980329851
,personal data referred to in paragraph 1 may be processed for the purposes referred to in point (h) of paragraph 2 when those data are processed by or under the responsibility of a professional subject to the obligation of professional secrecy under union or member state law or rules established by national competent bodies or by another person also subject to an obligation of secrecy under union or member state law or rules established by national competent bodies.,"sole paragraph. for purposes of item i of this article, the legal entities of public law referred to in the sole paragraph of art. 1 of law no. 12,527, of november 18, 2011 (the “brazilian access to information law”), within their legal capabilities, and those parties accountable, within the scope of their activities, may request the national authority to evaluate the level of protection of personal data provided by a country or international organization.",0.980277535
,"the controller shall implement appropriate technical and organisational measures for ensuring that, by default, only personal data which are necessary for each specific purpose of the processing are processed. that obligation applies to the amount of personal data collected, the extent of their processing, the period of their storage and their accessibility. in particular, such measures shall ensure that by default personal data are not made accessible without the individual's intervention to an indefinite number of natural persons.","§1 when establishing rules of good practices, the controller and the processor shall take into consideration, regarding the processing and the data, the nature, scope, purpose and probability and seriousness of the risks and the benefits that will result from the processing of the data subject’s data.",0.980273593
,"the controller no longer needs the personal data for the purposes of the processing, but they are required by the data subject for the establishment, exercise or defence of legal claims;","– to request, at any time, that entities of the public authority carry out operations of processing of personal data to give specific report about the scope and nature of the data and other details of the processing, and may issue complementary technical opinion to ensure compliance with this law;",0.9802122
,"processing is necessary for the purposes of the legitimate interests pursued by the controller or by a third party, except where such interests are overridden by the interests or fundamental rights and freedoms of the data subject which require protection of personal data, in particular where the data subject is a child.","– when necessary to fulfill the legitimate interests of the controller or a third party, except when the data subject’s fundamental rights and liberties which require personal data protection prevail; or",0.98018679
,"the rights of data subjects in regard to processing and the means to exercise those rights, including the right not to be subject to decisions based solely on automated processing, including profiling in accordance with article 22, the right to lodge a complaint with the competent supervisory authority and before the competent courts of the member states in accordance with article 79, and to obtain redress and, where appropriate, compensation for a breach of the binding corporate rules;","§2 processing of the data referred to in item iii of the lead sentence of this article is forbidden for legal entity of private law, except in procedures under the authority of legal entity of public law, of which the national authority shall be specifically informed and which shall observe the limitation imposed in §4 of this article.",0.980123497
,"‘controller’ means the natural or legal person, public authority, agency or other body which, alone or jointly with others, determines the purposes and means of the processing of personal data; where the purposes and means of such processing are determined by union or member state law, the controller or the specific criteria for its nomination may be provided for by union or member state law;","sole paragraph. for purposes of item i of this article, the legal entities of public law referred to in the sole paragraph of art. 1 of law no. 12,527, of november 18, 2011 (the “brazilian access to information law”), within their legal capabilities, and those parties accountable, within the scope of their activities, may request the national authority to evaluate the level of protection of personal data provided by a country or international organization.",0.980065812
,"taking into account the state of the art, the cost of implementation and the nature, scope, context and purposes of processing as well as the risks of varying likelihood and severity for rights and freedoms of natural persons posed by the processing, the controller shall, both at the time of the determination of the means for processing and at the time of the processing itself, implement appropriate technical and organisational measures, such as pseudonymisation, which are designed to implement data-protection principles, such as data minimisation, in an effective manner and to integrate the necessary safeguards into the processing in order to meet the requirements of this regulation and protect the rights of data subjects.","§1 when establishing rules of good practices, the controller and the processor shall take into consideration, regarding the processing and the data, the nature, scope, purpose and probability and seriousness of the risks and the benefits that will result from the processing of the data subject’s data.",0.979945099
,this regulation shall not impose additional obligations on natural or legal persons in relation to processing in connection with the provision of publicly available electronic communications services in public communication networks in the union in relation to matters for which they are subject to specific obligations with the same objective set out in directive 2002/58/ec.,"§1 processing of personal data as provided in item iii shall be governed by specific legislation, which shall provide proportional and strictly necessary measures for fulfilling the public interest, subject to due legal process, the general principles of protection and the rights of the data subjects as provided in this law.",0.979819659
,"where a transfer could not be based on a provision in article 45 or 46, including the provisions on binding corporate rules, and none of the derogations for a specific situation referred to in the first subparagraph of this paragraph is applicable, a transfer to a third country or an international organisation may take place only if the transfer is not repetitive, concerns only a limited number of data subjects, is necessary for the purposes of compelling legitimate interests pursued by the controller which are not overridden by the interests or rights and freedoms of the data subject, and the controller has assessed all the circumstances surrounding the data transfer and has on the basis of","§1 the national authority may provide minimum technical standards to make the provisions of the lead sentence of this article applicable, taking into account the nature of the",0.979650049
