Ken,gdpr recital,bdpr recital,similarity
,"monitor relevant developments, insofar as they have an impact on the protection of personal data, in particular the development of information and communication technologies and commercial practices;","studies carried out by a research entity, whenever possible ensuring the anonymization of sensitive personal data;",0.963457802
,"each supervisory authority shall facilitate the submission of complaints referred to in point (f) of paragraph 1 by measures such as a complaint submission form which can also be completed electronically, without excluding other means of communication.","§5 guarantees that are sufficient for compliance with the general principles of protection and data subject’s rights referred to in the lead sentence of this article shall also be analyzed in accordance with the technical and organizational measures adopted by the processor, according to the provisions of §§1 and 2 of art. 46 of this law.",0.963401476
,"a transfer of personal data to a third country or an international organisation may take place where the commission has decided that the third country, a territory or one or more specified sectors within that third country, or the international organisation in question ensures an adequate level of protection. such a transfer shall not require any specific authorisation.","amends law no. 13,709 of august 14, 2018, to provide for the protection of personal data and to create the national data protection authority; and makes other arrangements.",0.963360013
,"this regulation shall be without prejudice to the application of directive 2000/31/ec, in particular of the liability rules of intermediary service providers in articles 12 to 15 of that directive.","§2 processing of the data referred to in item iii of the lead sentence of this article is forbidden for legal entity of private law, except in procedures under the authority of legal entity of public law, of which the national authority shall be specifically informed and which shall observe the limitation imposed in §4 of this article.",0.963246293
,each member state shall provide by law for all of the following:,"sole paragraph. the general provisions of this law are of national interest and must be observed by the federal union, states, federal district and municipalities. (by law no. 13,853/2019)",0.963153228
,"the communication to the data subject referred to in paragraph 1 of this article shall describe in clear and plain language the nature of the personal data breach and contain at least the information and measures referred to in points (b), (c) and (d) of article 33(3).","§2 when processing data as mentioned in §1 of this article, controllers shall make public the information about the types of data collected, the way it is used and the procedures for exercising the rights of data subjects referred to in art. 18 of this law.",0.963117451
,"where, and in so far as, it is not possible to provide the information at the same time, the information may be provided in phases without undue further delay.","– to request, at any time, that entities of the public authority carry out operations of processing of personal data to give specific report about the scope and nature of the data and other details of the processing, and may issue complementary technical opinion to ensure compliance with this law;",0.963055711
,"the controller shall make reasonable efforts to verify in such cases that consent is given or authorised by the holder of parental responsibility over the child, taking into consideration available technology.","§5 the controller who has obtained the consent referred to in item i of the lead sentence of this article that needs to communicate or share personal data with other controllers shall obtain specific consent from the data subject for this purpose, except when the need for such consent is waived as provided in this law.",0.963047708
,communicate the name and contact details of the data protection officer or other contact point where more information can be obtained;,"§1 the identity and contact information of the data protection officer shall be publicly disclosed, in a clear and objective manner, preferably on the controller’s website.",0.96299274
,the personal data are no longer necessary in relation to the purposes for which they were collected or otherwise processed;,"– transparency: guarantee to the data subjects of clear, precise and easily accessible information about the carrying out of the processing and the respective processing agents, subject to commercial and industrial secrecy;",0.962916362
,processing shall be lawful only if and to the extent that at least one of the following applies:,"§1 the communication shall be done in a reasonable time period, as defined by the national authority, and shall contain, at the very least:",0.962906207
,"at the choice of the controller, deletes or returns all the personal data to the controller after the end of the provision of services relating to processing, and deletes existing copies unless union or member state law requires storage of the personal data;","§3 when processing originates from the consent of the data subject or from a contract, the data subject may request a complete electronic copy of her/his personal data, subject to commercial and industrial secrecy, in accordance with regulations of the national authority, in a format that allows its subsequent use, including for other processing operations.",0.962875373
,"‘personal data breach’ means a breach of security leading to the accidental or unlawful destruction, loss, alteration, unauthorised disclosure of, or access to, personal data transmitted, stored or otherwise processed;","– security: use of technical and administrative measures which are able to protect personal data from unauthorized accesses and accidental or unlawful situations of destruction, loss, alteration, communication or dissemination;",0.96280924
,the supervisory authority shall apply the consistency mechanism referred to in article 63 in the cases referred to in paragraph 3 of this article.,"sole paragraph. the information to be given to the national authority referred to in this article shall be subject to regulation.” (included by law no. 13,853/2019)",0.962804166
,"where more than one controller or processor, or both a controller and a processor, are involved in the same processing and where they are, under paragraphs 2 and 3, responsible for any damage caused by processing, each controller or processor shall be held liable for the entire damage in order to ensure effective compensation of the data subject.","– processors are jointly liable for damages caused by the processing when they do not comply with the obligations of data protection legislation or when they have not followed controller’s lawful instructions. in this last case, the processor is deemed equivalent to the controller, save from cases of exclusion as provided in art. 43 of this law;",0.962728121
,"for the purpose of paragraph 1, the commission may request information from member states and supervisory authorities.","§2 the president of the republic shall be responsible for determining the preventive work leave, solely when recommended by the special commission referred in the §1 of this article, and then hand down the decision. (included by law no. 13,853/2019)",0.962685956
,referred to in article 33(1) and (2) and for the particular circumstances in which a controller or a processor is required to notify the personal data breach;,§7 the portability of personal data referred to in item v of the lead sentence of this article does not include data that have already been anonymized by the controller.,0.962479334
,"after being notified of the decision of the lead supervisory authority pursuant to paragraphs 7 and 9, the controller or processor shall take the necessary measures to ensure compliance with the decision as regards processing activities in the context of all its establishments in the union. the controller or processor shall notify the measures taken for complying with the decision to the lead supervisory authority, which shall inform the other supervisory authorities concerned.","§2 the national authority shall verify the seriousness of the incident if necessary to safeguard the data subjects’ rights, it may order the controller to adopt measures, such as:",0.962457313
,develop international cooperation mechanisms to facilitate the effective enforcement of legislation for the protection of personal data;,"§4 the anpd shall maintain a permanent communication forum, including by technical cooperation, with bodies and entities of the public administration responsible for the regulation of specific sectors of economic and governmental activity, in order to facilitate",0.962362847
,"as regards a controller with establishments in more than one member state, the place of its central administration in the union, unless the decisions on the purposes and means of the processing of personal data are taken in another establishment of the controller in the union and the latter establishment has the power to have such decisions implemented, in which case the establishment having taken such decisions is to be considered to be the main establishment;","sole paragraph. for purposes of item i of this article, the legal entities of public law referred to in the sole paragraph of art. 1 of law no. 12,527, of november 18, 2011 (the “brazilian access to information law”), within their legal capabilities, and those parties accountable, within the scope of their activities, may request the national authority to evaluate the level of protection of personal data provided by a country or international organization.",0.962361104
,"processing on a large scale of special categories of data referred to in article 9(1), or of personal data relating to criminal convictions and offences referred to in article 10; or","§4 under no circumstances the entirety of the personal data in a database, as provided in item iii of the lead sentence of this article, may be processed by a legal entity of private law.",0.962350912
,"certification shall be issued to a controller or processor for a maximum period of three years and may be renewed, under the same conditions, provided that the relevant requirements continue to be met. certification shall be withdrawn, as applicable, by the certification bodies referred to in article 43 or by the competent supervisory authority where the requirements for the certification are not or are no longer met.","§3 the national authority may designate certification entities to carry out the provisions of the lead sentence of this article, which shall remain under their inspection and subject to the terms defined in regulation.",0.962228809
,"the processor and any person acting under the authority of the controller or of the processor, who has access to personal data, shall not process those data except on instructions from the controller, unless required to do so by union or member state law.",– processor: natural person or legal entity of either public or private law that processes personal data in the name of the controller;,0.962088621
,"to authorise processing referred to in article 36(5), if the law of the member state requires such prior authorisation;","§2 the provisions of this law do not exempt the legal entities mentioned in the lead sentence of this article from establishing the authorities as provided in law no. 12,527, of november 18, 2011 (the “brazilian access to information law”).",0.962085367
,"without prejudice to the exercise of its rights vis-à-vis third parties and with the exception of paragraph 5, each member state shall refrain, in the case provided for in paragraph 1, from requesting reimbursement from another member state in relation to damage referred to in paragraph 4.","§2 when the provisions of lines a and b of item ii of the lead sentence of this article are applied by public agencies and entities, said waiver of consent shall be publicized, pursuant to item i of the lead sentence of art. 23 of this law.",0.961928401
,an assessment of the risks to the rights and freedoms of data subjects referred to in paragraph 1; and,"§1 disclosure of the results or of any portion of the study or the research, as mentioned in the lead sentence of this article, shall under no circumstances reveal personal data.",0.96191796
,"the commission may adopt implementing acts of general scope in order to specify the arrangements for the exchange of information by electronic means between supervisory authorities, and between supervisory authorities and the board, in particular the standardised format referred to in article 64.","§1 processing of personal data as provided in item iii shall be governed by specific legislation, which shall provide proportional and strictly necessary measures for fulfilling the public interest, subject to due legal process, the general principles of protection and the rights of the data subjects as provided in this law.",0.961901133
,"the controller shall document any personal data breaches, comprising the facts relating to the personal data breach, its effects and the remedial action taken. that documentation shall enable the supervisory authority to verify compliance with this article.","– to request, at any time, that entities of the public authority carry out operations of processing of personal data to give specific report about the scope and nature of the data and other details of the processing, and may issue complementary technical opinion to ensure compliance with this law;",0.961900721
,"the member or members of each supervisory authority shall, in the performance of their tasks and exercise of their powers in accordance with this regulation, remain free from external influence, whether direct or indirect, and shall neither seek nor take instructions from anybody.","§2 the national authority shall verify the seriousness of the incident if necessary to safeguard the data subjects’ rights, it may order the controller to adopt measures, such as:",0.96176964
,"it would involve disproportionate effort. in such a case, there shall instead be a public communication or similar measure whereby the data subjects are informed in an equally effective manner.","§1 processing of personal data as provided in item iii shall be governed by specific legislation, which shall provide proportional and strictly necessary measures for fulfilling the public interest, subject to due legal process, the general principles of protection and the rights of the data subjects as provided in this law.",0.961741408
,"promote common training programmes and facilitate personnel exchanges between the supervisory authorities and, where appropriate, with the supervisory authorities of third countries or with international organisations;","§4 the anpd shall maintain a permanent communication forum, including by technical cooperation, with bodies and entities of the public administration responsible for the regulation of specific sectors of economic and governmental activity, in order to facilitate",0.961699608
,"the data subject shall have the right to receive the personal data concerning him or her, which he or she has provided to a controller, in a structured, commonly used and machine-readable format and have the right to transmit those data to another controller without hindrance from the controller to which the personal data have been provided, where:","§4 communication or shared use between controllers of sensitive personal data referring to health for the purpose of obtaining an economic advantage is prohibited, except in cases of portability of data when consented by the data subject.",0.961646119
,"where the lead supervisory authority intends to follow the relevant and reasoned objection made, it shall submit to the other supervisory authorities concerned a revised draft decision for their opinion. that revised draft decision shall be subject to the procedure referred to in paragraph 4 within a period of two weeks.","§3 the national authority shall issue technical opinions or recommendations regarding the exceptions provided in item iii of the lead sentence of this article, and shall request of the responsible parties a data protection impact assessment.",0.961518141
,"without prejudice to article 55, the supervisory authority of the main establishment or of the single establishment of the controller or processor shall be competent to act as lead supervisory authority for the cross-border processing carried out by that controller or processor in accordance with the procedure provided in article 60.","– processors are jointly liable for damages caused by the processing when they do not comply with the obligations of data protection legislation or when they have not followed controller’s lawful instructions. in this last case, the processor is deemed equivalent to the controller, save from cases of exclusion as provided in art. 43 of this law;",0.961509992
,"where a supervisory authority has taken a measure pursuant to paragraph 1 and considers that final measures need urgently be adopted, it may request an urgent opinion or an urgent binding decision from the board, giving reasons for requesting such opinion or decision.","§3 the national authority shall issue technical opinions or recommendations regarding the exceptions provided in item iii of the lead sentence of this article, and shall request of the responsible parties a data protection impact assessment.",0.961494004
,"to monitor compliance with this regulation, with other union or member state data protection provisions and with the policies of the controller or processor in relation to the protection of personal data, including the assignment of responsibilities, awareness-raising and training of staff involved in processing operations, and the related audits;","§3 the national authority may provide for standards and techniques to be used in processes of anonymization, and carry out security checks, with opinions from the national board for the protection of personal data.",0.96132339
,"administrative fines shall, depending on the circumstances of each individual case, be imposed in addition to, or instead of, measures referred to in points (a) to (h) and (j) of article 58(2). when deciding whether to impose an administrative fine and deciding on the amount of the administrative fine in each individual case due regard shall be given to the following:","§1 the national authority may provide minimum technical standards to make the provisions of the lead sentence of this article applicable, taking into account the nature of the",0.961280338
,"the transfer is necessary in order to protect the vital interests of the data subject or of other persons, where the data subject is physically or legally incapable of giving consent;","§2 in the situation when consent is required, if there are changes in the purpose of the processing of personal data that are not compatible with the original consent, the controller shall previously inform the data subject of the changes of purpose, and the data subject may revoke her/his consent if she/he disagrees with the changes.",0.961188185
,"the accreditation of certification bodies as referred to in paragraphs 1 and 2 of this article shall take place on the basis of criteria approved by the supervisory authority which is competent pursuant to article 55 or 56 or by the board pursuant to article 63. in the case of accreditation pursuant to point (b) of paragraph 1 of this article, those requirements shall complement those envisaged in regulation (ec) no 765/2008 and the technical rules that describe the methods and procedures of the certification bodies.","§5 guarantees that are sufficient for compliance with the general principles of protection and data subject’s rights referred to in the lead sentence of this article shall also be analyzed in accordance with the technical and organizational measures adopted by the processor, according to the provisions of §§1 and 2 of art. 46 of this law.",0.960982941
,"encourage the drawing up of codes of conduct pursuant to article 40(1) and provide an opinion and approve such codes of conduct which provide  sufficient  safeguards,  pursuant  to  article 40(5);","§5 guarantees that are sufficient for compliance with the general principles of protection and data subject’s rights referred to in the lead sentence of this article shall also be analyzed in accordance with the technical and organizational measures adopted by the processor, according to the provisions of §§1 and 2 of art. 46 of this law.",0.960934455
,"is necessary for entering into, or performance of, a contract between the data subject and a data controller;","– anonymized data: data related to a data subject who cannot be identified, considering the use of reasonable and available technical means at the time of the processing;",0.960916313
,"where the processing is based on point (f) of article 6(1), the legitimate interests pursued by the controller or by a third party;",§8 the right referred to in §1 of this article may also be exercised before consumer- defense entities.,0.960862485
,a controller or processor shall be exempt from liability under paragraph 2 if it proves that it is not in any way responsible for the event giving rise to the damage.,"– processors are jointly liable for damages caused by the processing when they do not comply with the obligations of data protection legislation or when they have not followed controller’s lawful instructions. in this last case, the processor is deemed equivalent to the controller, save from cases of exclusion as provided in art. 43 of this law;",0.960855028
,"out-of-court proceedings and other dispute resolution procedures for resolving disputes between controllers and data subjects with regard to processing, without prejudice to the rights of data subjects pursuant to articles 77 and 79.","§2 the data subject may oppose the processing carried out based on one of the situations of waiver of consent, if there is noncompliance with the provisions of this law.",0.960678528
,the measures and safeguards provided to protect the rights and freedoms of data subjects pursuant to this regulation;,"ensuring the prevention of fraud and the safety of the data subject, in processes of identification and authentication of registration in electronic systems, respecting the rights mentioned in art. 9 of this law and except when fundamental rights and liberties of the data subject which require protection of personal data prevail.",0.960663691
,the staff of the european data protection supervisor involved in carrying out the tasks conferred on the board by this regulation shall be subject to separate reporting lines from the staff involved in carrying out tasks conferred on the european data protection supervisor.,"§3 the national authority may provide for standards and techniques to be used in processes of anonymization, and carry out security checks, with opinions from the national board for the protection of personal data.",0.960652888
,"where, in accordance with paragraph 1, staff of a seconding supervisory authority operate in another member state, the member state of the host supervisory authority shall assume responsibility for their actions, including liability, for any damage caused by them during their operations, in accordance with the law of the member state in whose territory they are operating.","§1 pursuant to the lead sentence of this article, the president’s chief of staff shall be responsible for initiating the disciplinary administrative proceeding, which shall be conducted by a special commission composed of stable federal public servants.",0.960621387
,promote the cooperation and the effective bilateral and multilateral exchange of information and best practices between the supervisory authorities;,"§4 the anpd shall maintain a permanent communication forum, including by technical cooperation, with bodies and entities of the public administration responsible for the regulation of specific sectors of economic and governmental activity, in order to facilitate",0.960616775
,provisions to be inserted into administrative arrangements between public authorities or bodies which include enforceable and effective data subject rights.,"§1 processing of personal data as provided in item iii shall be governed by specific legislation, which shall provide proportional and strictly necessary measures for fulfilling the public interest, subject to due legal process, the general principles of protection and the rights of the data subjects as provided in this law.",0.960507063
,standard data protection clauses adopted by the commission in accordance with the examination procedure referred to in article 93(2);,"§5 guarantees that are sufficient for compliance with the general principles of protection and data subject’s rights referred to in the lead sentence of this article shall also be analyzed in accordance with the technical and organizational measures adopted by the processor, according to the provisions of §§1 and 2 of art. 46 of this law.",0.960494902
