Ken,gdpr recital,bdpr recital,similarity
,"where the controller intends to further process the personal data for a purpose other than that for which the personal data were obtained, the controller shall provide the data subject prior to that further processing with information on that other purpose and with any relevant further information as referred to in paragraph 2.","§4 communication or shared use between controllers of sensitive personal data referring to health for the purpose of obtaining an economic advantage is prohibited, except in cases of portability of data when consented by the data subject.",0.970188744
,"the commission, after assessing the adequacy of the level of protection, may decide, by means of implementing act, that a third country, a territory or one or more specified sectors within a third country, or an international organisation ensures an adequate level of protection within the meaning of paragraph 2 of this article. the implementing act shall provide for a mechanism for a periodic review, at least every four years, which shall take into account all relevant developments in the third country or international organisation. the implementing act shall specify its territorial and sectoral application and, where applicable, identify the supervisory authority or authorities referred to in point","§3 the national authority may designate certification entities to carry out the provisions of the lead sentence of this article, which shall remain under their inspection and subject to the terms defined in regulation.",0.97017432
,this regulation applies to the processing of personal data wholly or partly by automated means and to the processing other than by automated means of personal data which form part of a filing system or are intended to form part of a filing system.,"§3 when processing originates from the consent of the data subject or from a contract, the data subject may request a complete electronic copy of her/his personal data, subject to commercial and industrial secrecy, in accordance with regulations of the national authority, in a format that allows its subsequent use, including for other processing operations.",0.970049308
,"where the controller intends to further process the personal data for a purpose other than that for which the personal data were collected, the controller shall provide the data subject prior to that further processing with information on that other purpose and with any relevant further information as referred to in paragraph 2.","§4 communication or shared use between controllers of sensitive personal data referring to health for the purpose of obtaining an economic advantage is prohibited, except in cases of portability of data when consented by the data subject.",0.969931573
,point (f) of the first subparagraph shall not apply to processing carried out by public authorities in the performance of their tasks.,"§1 the communication shall be done in a reasonable time period, as defined by the national authority, and shall contain, at the very least:",0.9698715
,"where the supervisory authority concerned informs the chair of the board within the period referred to in paragraph 7 of this article that it does not intend to follow the opinion of the board, in whole or in part, providing the relevant grounds, article 65(1) shall apply.","§2 the president of the republic shall be responsible for determining the preventive work leave, solely when recommended by the special commission referred in the §1 of this article, and then hand down the decision. (included by law no. 13,853/2019)",0.969836569
,"information provided under articles 13 and 14 and any communication and any actions taken under articles 15 to 22 and 34 shall be provided free of charge. where requests from a data subject are manifestly unfounded or excessive, in particular because of their repetitive character, the controller may either:","§2 when processing data as mentioned in §1 of this article, controllers shall make public the information about the types of data collected, the way it is used and the procedures for exercising the rights of data subjects referred to in art. 18 of this law.",0.969731949
,"the member states, the supervisory authorities, the board and the commission shall encourage the drawing up of codes of conduct intended to contribute to the proper application of this regulation, taking account of the specific features of the various processing sectors and the specific needs of micro, small and medium-sized enterprises.","§3 the national authority may provide for standards and techniques to be used in processes of anonymization, and carry out security checks, with opinions from the national board for the protection of personal data.",0.969608978
,"the commission may, by means of implementing acts, specify the format and procedures for mutual assistance referred to in this article and the arrangements for the exchange of information by electronic means between supervisory authorities, and between supervisory authorities and the board, in particular the standardised format referred to in paragraph 6 of this article. those implementing acts shall be adopted in accordance with the examination procedure referred to in article 93(2).","sole paragraph. the information to be given to the national authority referred to in this article shall be subject to regulation.” (included by law no. 13,853/2019)",0.969592231
,"taking into account the nature of the processing, assists the controller by appropriate technical and organisational measures, insofar as this is possible, for the fulfilment of the controller's obligation to respond to requests for exercising the data subject's rights laid down in chapter iii;","§1 processing of personal data as provided in item iii shall be governed by specific legislation, which shall provide proportional and strictly necessary measures for fulfilling the public interest, subject to due legal process, the general principles of protection and the rights of the data subjects as provided in this law.",0.969533002
,"paragraph 1 shall not affect the general contract law of member states such as the rules on the validity, formation or effect of a contract in relation to a child.","§3 the national authority may designate certification entities to carry out the provisions of the lead sentence of this article, which shall remain under their inspection and subject to the terms defined in regulation.",0.969521267
,member states may maintain or introduce more specific provisions to adapt the application of the rules of this regulation with regard to processing for compliance with points (c) and (e) of paragraph,"§1 processing of personal data as provided in item iii shall be governed by specific legislation, which shall provide proportional and strictly necessary measures for fulfilling the public interest, subject to due legal process, the general principles of protection and the rights of the data subjects as provided in this law.",0.969415853
,"this regulation applies to the processing of personal data by a controller not established in the union, but in a place where member state law applies by virtue of public international law.","sole paragraph. for purposes of item i of this article, the legal entities of public law referred to in the sole paragraph of art. 1 of law no. 12,527, of november 18, 2011 (the “brazilian access to information law”), within their legal capabilities, and those parties accountable, within the scope of their activities, may request the national authority to evaluate the level of protection of personal data provided by a country or international organization.",0.969401296
,"‘relevant and reasoned objection’ means an objection to a draft decision as to whether there is an infringement of this regulation, or whether envisaged action in relation to the controller or processor complies with this regulation, which clearly demonstrates the significance of the risks posed by the draft decision as regards the fundamental rights and freedoms of data subjects and, where applicable, the free flow of personal data within the union;",demonstrate the controller’s commitment to adopt internal procedures and policies that ensure broad compliance with rules and good practices regarding the protection of personal data;,0.969308395
,"the commission may specify the format and procedures for the exchange of information between controllers, processors and supervisory authorities for binding corporate rules within the meaning of this article. those implementing acts shall be adopted in accordance with the examination procedure set out in article 93(2).","§2 processing of the data referred to in item iii of the lead sentence of this article is forbidden for legal entity of private law, except in procedures under the authority of legal entity of public law, of which the national authority shall be specifically informed and which shall observe the limitation imposed in §4 of this article.",0.969279416
,the possible consequences of the intended further processing for data subjects;,"§1 the provisions of this article apply to any processing of personal data that reveals sensitive personal data and that may cause harm to the data subject, subject to the provisions of specific legislation.",0.969250764
,establish and maintain a list in relation to the requirement for data protection impact assessment pursuant to article 35(4);,"§5 guarantees that are sufficient for compliance with the general principles of protection and data subject’s rights referred to in the lead sentence of this article shall also be analyzed in accordance with the technical and organizational measures adopted by the processor, according to the provisions of §§1 and 2 of art. 46 of this law.",0.969161857
,the certification bodies referred to in paragraph 1 shall be responsible for the proper assessment leading to the certification or the withdrawal of such certification without prejudice to the responsibility of the controller or processor for compliance with this regulation. the accreditation shall be issued for a maximum period of five years and may be renewed on the same conditions provided that the certification body meets the requirements set out in this article.,"§3 the national authority may designate certification entities to carry out the provisions of the lead sentence of this article, which shall remain under their inspection and subject to the terms defined in regulation.",0.969132808
,processing of personal data which takes place in the context of the activities of a single establishment of a controller or processor in the union but which substantially affects or is likely to substantially affect data subjects in more than one member state.,"– to stimulate the adoption of standards for services and products that facilitate the control of data subjects regarding their personal data, which should take into account the specificities of the activities and the size of those responsible;",0.96913234
,"the information to be provided to data subjects pursuant to articles 13 and 14 may be provided in combination with standardised icons in order to give in an easily visible, intelligible and clearly legible manner a meaningful overview of the intended processing. where the icons are presented electronically they shall be machine-readable.","§1 in situations where consent is required, it shall be considered void if the information provided to the data subject contains misleading or abusive content or was not previously presented in a transparent, clear and unambiguous way.",0.969045501
,"any supervisory authority may request an urgent opinion or an urgent binding decision, as the case may be, from the board where a competent supervisory authority has not taken an appropriate measure in a situation where there is an urgent need to act, in order to protect the rights and freedoms of data subjects, giving reasons for requesting such opinion or decision, including for the urgent need to act.","§2 the national authority shall verify the seriousness of the incident if necessary to safeguard the data subjects’ rights, it may order the controller to adopt measures, such as:",0.969014374
,"the annual report shall include a review of the practical application of the guidelines, recommendations and best practices referred to in point (l) of article 70(1) as well as of the binding decisions referred to in article 65.","§5 guarantees that are sufficient for compliance with the general principles of protection and data subject’s rights referred to in the lead sentence of this article shall also be analyzed in accordance with the technical and organizational measures adopted by the processor, according to the provisions of §§1 and 2 of art. 46 of this law.",0.968989985
,"where a joint operation is intended and a supervisory authority does not, within one month, comply with the obligation laid down in the second sentence of paragraph 2 of this article, the other supervisory authorities may adopt a provisional measure on the territory of its member state in accordance with article 55. in that case, the urgent need to act under article 66(1) shall be presumed to be met and require an opinion or an urgent binding decision from the board pursuant to article 66(2).","§2 the president of the republic shall be responsible for determining the preventive work leave, solely when recommended by the special commission referred in the §1 of this article, and then hand down the decision. (included by law no. 13,853/2019)",0.96892605
,"the exercise of the powers conferred on the supervisory authority pursuant to this article shall be subject to appropriate safeguards, including effective judicial remedy and due process, set out in union and member state law in accordance with the charter.","§5 in the exercise of the powers referred to in the lead sentence of this article, the relevant authority shall ensure the preservation of industrial and information secrecy, in the terms of the law.",0.968925474
,the controller has taken subsequent measures which ensure that the high risk to the rights and freedoms of data subjects referred to in paragraph 1 is no longer likely to materialise;,"§6 the controller shall immediately inform the processing agents with which she/he has carried out the shared use of data of the correction, deletion, anonymization or blocking of data, so that they can repeat an identical procedure, except in cases in which this action is proven impossible or involves disproportionate effort. (new wording given by law no. 13,853/2019)",0.968824856
,the transfer is necessary for the performance of a contract between the data subject and the controller or the implementation of pre-contractual measures taken at the data subject's request;,"§1 whenever requested to do so, the controller shall provide clear and adequate information regarding the criteria and procedures used for an automated decision, subject to commercial and industrial secrecy.",0.968775584
,"if the controller has not already communicated the personal data breach to the data subject, the supervisory authority, having considered the likelihood of the personal data breach resulting in a high risk, may require it to do so or may decide that any of the conditions referred to in paragraph 3 are met.","§3 when the processing of personal data is a condition for the provision of a product or service or for the exercise of a right, the data subject shall be informed with special highlight of this fact and of the means by which she/he may exercise her/his data subject’s rights as listed in art. 18 of this law.",0.968766699
,"in the cases referred to in paragraph 2 of this article, the supervisory authority shall inform the lead supervisory authority without delay on that matter. within a period of three weeks after being informed the lead supervisory authority shall decide whether or not it will handle the case in accordance with the procedure provided in article 60, taking into account whether or not there is an establishment of the controller or processor in the member state of which the supervisory authority informed it.","§2 the president of the republic shall be responsible for determining the preventive work leave, solely when recommended by the special commission referred in the §1 of this article, and then hand down the decision. (included by law no. 13,853/2019)",0.968737872
,the data subject shall have the right to obtain from the controller restriction of processing where one of the following applies:,"§1 whenever requested to do so, the controller shall provide clear and adequate information regarding the criteria and procedures used for an automated decision, subject to commercial and industrial secrecy.",0.96873616
,"whether the provision of personal data is a statutory or contractual requirement, or a requirement necessary to enter into a contract, as well as whether the data subject is obliged to provide the personal data and of the possible consequences of failure to provide such data;","– to request, at any time, that entities of the public authority carry out operations of processing of personal data to give specific report about the scope and nature of the data and other details of the processing, and may issue complementary technical opinion to ensure compliance with this law;",0.968599011
,"where the controller or the processor is a public authority or body, a single data protection officer may be designated for several such authorities or bodies, taking account of their organisational structure and size.","§3 the national authority may establish complementary rules about the definition and the duties of the data protection officer, including situations in which the appointment of such person may be waived, according to the nature and the size of the entity or the volume of data processing operations.",0.96854674
,"where processing is carried out by public authorities or private bodies acting on the basis of point (c) or (e) of article 6(1), the supervisory authority of the member state concerned shall be competent. in such cases article 56 does not apply.","§5 guarantees that are sufficient for compliance with the general principles of protection and data subject’s rights referred to in the lead sentence of this article shall also be analyzed in accordance with the technical and organizational measures adopted by the processor, according to the provisions of §§1 and 2 of art. 46 of this law.",0.968540242
,"where personal data have not been obtained from the data subject, the controller shall provide the data subject with the following information:","§4 communication or shared use between controllers of sensitive personal data referring to health for the purpose of obtaining an economic advantage is prohibited, except in cases of portability of data when consented by the data subject.",0.968530863
,"if the personal data are to be used for communication with the data subject, at the latest at the time of the first communication to that data subject; or","– database: a structured set of personal data, kept in one or several locations, in electronic or physical support;",0.968452651
,the decision referred to in paragraph 1 shall be adopted within one month from the referral of the subject-matter by a two-thirds majority of the members of the board. that period may be extended by a further month on account of the complexity of the subject-matter. the decision referred to in paragraph 1 shall be reasoned and addressed to the lead supervisory authority and all the supervisory authorities concerned and binding on them.,"§3 the national authority shall issue technical opinions or recommendations regarding the exceptions provided in item iii of the lead sentence of this article, and shall request of the responsible parties a data protection impact assessment.",0.968375589
,"an approved certification mechanism pursuant to article 42 together with binding and enforceable commitments of the controller or processor in the third country to apply the appropriate safeguards, including as regards data subjects' rights.","§1 processing of personal data as provided in item iii shall be governed by specific legislation, which shall provide proportional and strictly necessary measures for fulfilling the public interest, subject to due legal process, the general principles of protection and the rights of the data subjects as provided in this law.",0.968299721
,"where the processing is based on point (a) of article 6(1) or point (a) of article 9(2), the existence of the right to withdraw consent at any time, without affecting the lawfulness of processing based on consent before its withdrawal;","§5 the request as mentioned in §3 of this article shall be fulfilled without costs to the data subject, within the time periods and the terms as provided in regulation.",0.968215272
,"where processing is based on point (a) of article 6(1) or point (a) of article 9(2), the existence of the right to withdraw consent at any time, without affecting the lawfulness of processing based on consent before its withdrawal;","§5 the request as mentioned in §3 of this article shall be fulfilled without costs to the data subject, within the time periods and the terms as provided in regulation.",0.968215272
,"collected for specified, explicit and legitimate purposes and not further processed in a manner that is incompatible with those purposes; further processing for archiving purposes in the public interest, scientific or historical research purposes or statistical purposes shall, in accordance with article 89(1), not be considered to be incompatible with the initial purposes (‘purpose limitation’);","– purpose: processing done for legitimate, specific and explicit purposes of which the data subject is informed, with no possibility of subsequent processing that is incompatible with these purposes;",0.968088921
,"the controller has implemented appropriate technical and organisational protection measures, and those measures were applied to the personal data affected by the personal data breach, in particular those that render the personal data unintelligible to any person who is not authorised to access it, such as encryption;","§4 communication or shared use between controllers of sensitive personal data referring to health for the purpose of obtaining an economic advantage is prohibited, except in cases of portability of data when consented by the data subject.",0.96788239
,the data subject has objected to processing pursuant to article 21(1) pending the verification whether the legitimate grounds of the controller override those of the data subject.,"– when necessary for the execution of a contract or preliminary procedures related to a contract of which the data subject is a party, at the request of the data subject;",0.967878651
,"when the personal data breach is likely to result in a high risk to the rights and freedoms of natural persons, the controller shall communicate the personal data breach to the data subject without undue delay.","– data protection impact assessment1 : documentation from the controller that contains the description concerning the proceedings of the personal data processing that could pose risks to civil liberties and fundamental rights, as well as measures, safeguards and mechanisms to mitigate said risk;",0.967796027
,"a code of conduct referred to in paragraph 2 of this article shall contain mechanisms which enable the body referred to in article 41(1) to carry out the mandatory monitoring of compliance with its provisions by the controllers or processors which undertake to apply it, without prejudice to the tasks and powers of supervisory authorities competent pursuant to article 55 or 56.","§5 guarantees that are sufficient for compliance with the general principles of protection and data subject’s rights referred to in the lead sentence of this article shall also be analyzed in accordance with the technical and organizational measures adopted by the processor, according to the provisions of §§1 and 2 of art. 46 of this law.",0.967794862
,"where a processor engages another processor for carrying out specific processing activities on behalf of the controller, the same data protection obligations as set out in the contract or other legal act between the controller and the processor as referred to in paragraph 3 shall be imposed on that other processor by way of a contract or other legal act under union or member state law, in particular providing sufficient guarantees to implement appropriate technical and organisational measures in such a manner that the processing will meet the requirements of this regulation. where that other processor fails to fulfil its data protection obligations, the initial processor shall remain fully liable to the controller for the performance of that other processor's obligations.","– processors are jointly liable for damages caused by the processing when they do not comply with the obligations of data protection legislation or when they have not followed controller’s lawful instructions. in this last case, the processor is deemed equivalent to the controller, save from cases of exclusion as provided in art. 43 of this law;",0.967784482
,"the exercise by the supervisory authority of its powers under this article shall be subject to appropriate procedural safeguards in accordance with union and member state law, including effective judicial remedy and due process.","§5 in the exercise of the powers referred to in the lead sentence of this article, the relevant authority shall ensure the preservation of industrial and information secrecy, in the terms of the law.",0.967731948
